toxic_sentence	neutral_sentence	lang
Si fuese verdad se lo estaría pagando el gobierno y les darían una paga para que no tengan problemas económicos.	Si eso fuera cierto, el gobierno les proporcionaría ayuda económica para evitar problemas financieros.	es
pues con lo puto retrasado que eres podría ser	en tu estado es posible	es
Cortocircuito buenrrollista, pobres inmigrantes vs chica atacada sexualmente.	Es un conflicto entre el enfoque positivo y la compasión por los inmigrantes, frente a la preocupación por una chica atacada sexualmente.	es
callate ya, subnormal, admite el PARTIDAZO como todos los madridistas, no que por rabia digais que ha sido robo, penosa.	admite el PARTIDAZO como todos los madridistas, no que por rabia digais que ha sido robo	es
Que asco da la gente homófoba, COMENTO. — MUCHO ASCO	No soporta la gente homófoba	es
Nunca sean así de mierdas.	Nunca sean así  de malos	es
Cómo me alegro de la remontada por todos los madridistas insoportables y por el subnormal miarma de Emery!!	Cómo me alegro de la remontada por todos los madridistas y por el miarma de Emery!!	es
Si controlan mucho porque son dictadores, si no controlan son pelotudos.	Si controlan mucho porque son dictadores, si no controlan están haciendo cosas mal	es
Potencialmente Sánchez es el que más daño puede hacer, primer psicopata que llega a ser presidente en España.	Potencialmente Sánchez es el que más daño puede hacer, primer persona que llega a ser presidente en España.	es
se tiene q ser subnormal profundo, pero como dice  este es la nueva manera de hacer periodismo. Pues ala	Le tiene que estar pasando algo, pero, como se dice, este es la nueva manera de hacer periodismo.	es
Yo lo se, los mismos fascistas corruptos ladrones que estan acabando con la Civilización en la Tierra	Yo lo se, los mismos que estan acabando con la Civilización en la Tierra	es
Jajajajajaja que Martin de mierda	Jajajajaja que Martin	es
Donde esta el venezolano de mierda, donde	Dónde está el venezolano	es
"#Lista Allanamientos, persecución y exilio: la aberración de #ANC contra diputados  `"""	"# Lista de invasiones, persecuciones y expulsiones: # ANC contra diputados `"""	es
Por encima de la libertad de expresión está la libertad de callarse para no decir gilipolleces sin sentido	Por encima de la libertad de expresión está la libertad de permanecer en silencio para no decir cosas sin sentido	es
Ya decía yo que veía menos moros	Ya me había dado cuenta que veía menos personas de origen magrebí	es
Desde que los nazis falsificaron billetes en los campos,este es el peor ataque a la economia de un pais	Desde qué los nacionalsocialistas falsificaron billets en los campos, este es el peor ataque a la economía de un pais	es
Estos fascistas de la oposición venezolana, y sus achichincles en España, tienen la suerte de que no somos como ellos.	Estas personas de la oposición venezolana y sus cómplices en España tienen la suerte de que no somos como ellos.	es
Que red social de mierda	Qué mala red social	es
Cogiendo el testigo de su colega,el mongolo Roncero. Vaya paga que tienes,carajaula	Cogiendo el testigo de su colegaRoncero. Vaya paga que tienes	es
a la mierda directamente, OKUPAS en el gobierno.	OKUPAS en el gobierno.	es
Este va para casa de que politicucho? ya esta adjudicado, o se lo rifan?	¿Esto va para la casa de qué político?	es
Hable como Hernández, ya sabemos que podes hablar mierda en ese canal, NARCO ¿Seguridad?	Hable como Hernandez, ya sabemos que podes hablar mal de ese canal. ¿Seguridad?	es
Ahora me leo la secta que seguro que amplian información	Voy a leer el artículo para obtener más información.	es
Vaya, el VOXtarra guardia que se da por aludido.	Vaya, el miembro de VOX que se siente identificado.	es
Disney se está riendo en vuestra puta cara	Disney se está riendo de ustedes	es
Buena gente acogemos en nuestro país. Traen lo mejorcito de la cultura de su país.	Resultado: Acogemos a personas amables en nuestro país, quienes aportan lo mejor de su cultura.	es
